{
  "$schema": "https://json-schema.org/draft/2020-12/schema",
  "$id": "lane.schema.json",
  "title": "Lane",
  "description": "molds/<mold_id>/testing/<lane>/lane.json — what .claude/scripts/lanes.py runs for this lane. The lane declares itself; adding a lane to a future mold never edits the runner.",
  "type": "object",
  "additionalProperties": false,
  "required": [
    "lane",
    "checks"
  ],
  "properties": {
    "$schema": {
      "type": "string"
    },
    "lane": {
      "type": "string",
      "enum": [
        "load",
        "context",
        "functional",
        "accessibility",
        "responsiveness"
      ],
      "description": "Must be one of the five the application schema can record. Anything else is a runner error, not a silent skip: the result would have nowhere legal to live."
    },
    "order": {
      "type": "integer",
      "description": "Run order across lanes; ties broken by name. functional 10, context 20, load 30, accessibility 40, responsiveness 50."
    },
    "summary": {
      "type": "string",
      "description": "One line, printed in the report header."
    },
    "not_covered": {
      "type": "array",
      "items": {
        "type": "string"
      },
      "description": "What this lane does NOT check, printed verbatim in the report so a green lane cannot imply more than it measured."
    },
    "requires": {
      "type": "array",
      "items": {
        "$ref": "#/$defs/precondition"
      },
      "description": "Lane-level: any unmet precondition skips the WHOLE lane, quoting its `else`."
    },
    "checks": {
      "type": "array",
      "description": "Empty or absent means the lane has no harness: `skipped`, never `pass`.",
      "items": {
        "type": "object",
        "additionalProperties": false,
        "required": [
          "name",
          "run"
        ],
        "properties": {
          "name": {
            "type": "string",
            "description": "Unique within the lane; becomes the report row."
          },
          "run": {
            "type": "string",
            "description": "One shell command. Placeholders: {app_id} {root} {mold} {codebase} {default_codebase} {testing} {lane} {date} {url} {report} {deploy}. {deploy} is the flag of the one deploy command the application's target has (`--deploy`; `--deploy-remote` for a vm_remote application), so an instruction written once names the right command for every target: `python3 .claude/scripts/provision.py {app_id} {deploy}`."
          },
          "targets": {
            "type": "array",
            "minItems": 1,
            "items": {
              "type": "string",
              "enum": [
                "vercel",
                "vm",
                "vm_remote"
              ]
            },
            "description": "The deploy targets (infrastructure.target) this check exists for. Absent: every target. For an application of any other target the check is not part of the lane at all: it is not run, not listed, not counted and cannot make the lane `skipped`. Use it only for a check that measures something one target alone has (a python tool call in a sandbox the app's own server starts); a check that merely cannot run yet is a `requires`, which is recorded `skipped`."
          },
          "cwd": {
            "type": "string",
            "enum": [
              "codebase",
              "default_profile",
              "testing",
              "root"
            ],
            "description": "Default codebase. `codebase` is what THIS application ships: build/<app_id>.lane/ (mold + packs, the app's own deployment profile) for an app with packs, else molds/<mold_id>/codebase. `default_profile` is where the mold's OWN offline tests run: build/<app_id>.lane-default/ (mold + the packs' code, the DEFAULT profile) for an app with packs, else molds/<mold_id>/codebase. The mold's tests pin the default profile's words and fields, so on a relabelling pack's profile they fail by design (mold_v1-146/147); grade the app's own words with a `codebase` check."
          },
          "timeout_s": {
            "type": "integer",
            "description": "Default 600. A timeout is a FAIL with reason 'timed out after Ns'."
          },
          "expect": {
            "type": "object",
            "additionalProperties": false,
            "properties": {
              "exit": {
                "type": "integer",
                "description": "Default 0."
              },
              "stdout": {
                "type": "array",
                "items": {
                  "type": "string"
                },
                "description": "Every regex must match combined stdout+stderr."
              },
              "stdout_not": {
                "type": "array",
                "items": {
                  "type": "string"
                },
                "description": "None may match. This is how a lane refuses to grade on a status code."
              },
              "skip_on": {
                "type": "array",
                "description": "Judged after exit/stdout/stdout_not, so a failure is never hidden: if `stdout` matches, the check ran but declared part of what it names unmeasured, and is recorded `skipped` (never `pass`) with `else` as the reason; its measured rows still print. The lane is then `skipped`, never `pass`.",
                "items": {
                  "type": "object",
                  "additionalProperties": false,
                  "required": [
                    "stdout",
                    "else"
                  ],
                  "properties": {
                    "stdout": {
                      "type": "string",
                      "description": "Regex over combined stdout+stderr."
                    },
                    "else": {
                      "type": "string",
                      "description": "What the operator should do, in one sentence with the command in it; placeholders allowed."
                    }
                  }
                }
              }
            }
          },
          "requires": {
            "type": "array",
            "items": {
              "$ref": "#/$defs/precondition"
            },
            "description": "Check-level: unmet means this check is SKIPPED, never failed — and a lane with a skipped check can never be `pass`."
          },
          "emits": {
            "type": "string",
            "enum": [
              "markdown_table"
            ],
            "description": "stdout is a markdown table, inlined verbatim under 'Measured rows'."
          },
          "known_defect": {
            "type": "string",
            "description": "A task id. ANNOTATION ONLY: it never changes the verdict. It links the task in the report and stops a duplicate task being filed."
          },
          "why": {
            "type": "string",
            "description": "One sentence: what a failure here actually means."
          },
          "app_env": {
            "type": "array",
            "items": {
              "type": "string"
            },
            "description": "Names of THIS application's own secrets to place in the check's environment, read at run time from where the app's state says they live (the Vercel project's env for secret_store vercel_env, infra/vm/apps/<app>/.env for vm_env_file). Values are never printed, logged or stored; the report shows names only. A name that cannot be supplied makes the check skipped, never failed. Exists so a check that must connect AS the application (test:org-isolation, which is meaningless as a BYPASSRLS role) can run against a deployed app without anyone copying a URL into a file."
          }
        }
      }
    }
  },
  "$defs": {
    "precondition": {
      "type": "object",
      "additionalProperties": false,
      "required": [
        "else"
      ],
      "description": "Exactly one of state/env/path/cmd, plus `else`: one imperative sentence naming a runnable command.",
      "properties": {
        "state": {
          "type": "string",
          "description": "<application|infrastructure|datastores|datainfra>.<dotted path>"
        },
        "must": {
          "description": "'nonempty', or a literal the value must equal."
        },
        "must_not": {
          "description": "A literal the value must not equal."
        },
        "env": {
          "type": "string",
          "description": "Environment variable presence BY NAME. The value is never read, logged or stored."
        },
        "path": {
          "type": "string",
          "description": "Path relative to the repo root; placeholders allowed."
        },
        "cmd": {
          "type": "string",
          "description": "Probe command; must exit 0."
        },
        "else": {
          "type": "string",
          "description": "What the operator should do, in one sentence with the command in it."
        }
      }
    }
  }
}
