{
  "$schema": "../lane.schema.json",
  "lane": "load",
  "order": 30,
  "summary": "Task-workflow throughput, latency and journal integrity under concurrency, measured against a service built from this mold snapshot on a private, throwaway Postgres.",
  "not_covered": [
    "Thread-open latency for a signed-in operator. NOT COVERED, permanently, and not merely skipped. `scripts/fde/thread-open-perf.mjs` needs a Google ID token copied out of a signed-in browser's localStorage (or an emailed sign-in code): lib/ops-auth.ts admits exactly those two human identities and says so — \"There is deliberately no shared service key: every caller is a real, named human\" — and such a token lives about an hour. No factory script can mint one for a stamped app, and asking a non-technical operator to open a browser console is not an instruction this factory gives. The check used to sit in `checks` guarded by FDE_OPS_TOKEN, which is a name that appears NOWHERE in the mold (the script reads --token, --token-file or FDE_GOOGLE_TOKEN), so setting it would have run an unauthenticated baseline that exits 0 having measured no thread open at all — a `pass` with nothing behind it — and, with FDE_OPS_URL unset, against the LIVE fde-agent projects rather than this app. See README.md for what would have to change for it to become measurable.",
    "The DEPLOYED application. This lane builds services/task-workflow from the mold snapshot and runs it on this machine against a local Postgres; it does not touch the app's Vercel deployment or its database, so it measures the mold's engine, not the hosting.",
    "GLM 5.2 inference throughput and the sandbox prewarm saturation budget — neither has a harness yet (mold_fin backlog).",
    "Concurrent multi-workspace chat load: the scenario drives one org's task workflow, not many workspaces at once (mold_fin backlog).",
    "Sustained soak. The spec is a burst of about four seconds, not an hour, so connection-pool exhaustion, leaks and autovacuum pressure are outside what any row here can claim."
  ],
  "checks": [
    {
      "name": "test:task-workflow:stress",
      "run": "python3 {testing}/load/stress.py {app_id}",
      "cwd": "root",
      "emits": "markdown_table",
      "timeout_s": 1800,
      "why": "The task-workflow service is the multiplayer engine; p95 latency, throughput, HTTP errors and an intact transition journal under concurrency are what an operator feels.",
      "expect": {
        "exit": 0,
        "stdout": ["\\| stress\\.executed \\| pass \\|"],
        "stdout_not": ["\\| unmeasured \\|"]
      },
      "requires": [
        {
          "path": "{codebase}/tests/task-workflow-stress/workflow.stress.spec.ts",
          "else": "This mold snapshot has no task-workflow stress spec, so there is no scenario to run. Refresh the mold from source per molds/mold_fin/MOLD.md and run the lane again."
        },
        {
          "path": "{testing}/load/stress.py",
          "else": "The load lane's harness is missing. Restore molds/mold_fin/testing/load/stress.py from git (`git checkout molds/mold_fin/testing/load/stress.py`) and run the lane again."
        },
        {
          "path": "{codebase}/node_modules/@playwright/test",
          "else": "The mold's own dependencies are not installed on this machine, so the stress spec cannot run. Run `npm ci` inside molds/mold_fin/codebase and run the lane again."
        },
        {
          "cmd": "docker info",
          "else": "Docker is not running on this machine, and this lane builds its own throwaway database and task-workflow service inside it. Run `sudo systemctl start docker` and run the lane again."
        },
        {
          "cmd": "node -e \"fetch('https://registry.npmjs.org/workflow',{signal:AbortSignal.timeout(15000)}).then(r=>process.exit(r.ok?0:1)).catch(()=>process.exit(1))\"",
          "else": "This machine cannot reach https://registry.npmjs.org, and services/task-workflow's own dependencies are not vendored in the mold snapshot, so the service cannot be built. Reconnect this machine to the internet and run the lane again."
        }
      ]
    }
  ]
}
